<?xml version="1.0" encoding="utf-8"?>
<animes xmlns:xsi="http://www.w3.org/2001/XMLSchema-instance" 
		xsi:noNamespaceSchemaLocation="../../../../../../schemas/animes.xsd" 
		scale="4" >
<!-- 
	Total Boum Boum
	Copyright 2008-2012 Vincent Labatut 
	
	This file is part of Total Boum Boum.
	
	Total Boum Boum is free software: you can redistribute it and/or modify
	it under the terms of the GNU General Public License as published by
	the Free Software Foundation, either version 2 of the License, or
	(at your option) any later version.
	
	Total Boum Boum is distributed in the hope that it will be useful,
	but WITHOUT ANY WARRANTY; without even the implied warranty of
	MERCHANTABILITY or FITNESS FOR A PARTICULAR PURPOSE.  See the
	GNU General Public License for more details.
	
	You should have received a copy of the GNU General Public License
	along with Total Boum Boum.  If not, see <http://www.gnu.org/licenses/>.
 -->

	<gestures>
		<gesture name="BURNING" >
			<direction name="DOWN" folder="down">
				<step duration="50" file="1.png" />
				<step duration="60" file="2.png" />
				<step duration="80" file="3.png" />
				<step duration="80" file="4.png" />
				<step duration="100" file="5.png" />
				<step duration="80" file="4.png" />
				<step duration="80" file="3.png" />
				<step duration="60" file="2.png" />
				<step duration="50" file="1.png" />
			</direction>
			<direction name="LEFT" folder="left">
				<step duration="50" file="1.png" />
				<step duration="60" file="2.png" />
				<step duration="80" file="3.png" />
				<step duration="80" file="4.png" />
				<step duration="100" file="5.png" />
				<step duration="80" file="4.png" />
				<step duration="80" file="3.png" />
				<step duration="60" file="2.png" />
				<step duration="50" file="1.png" />
			</direction>
			<direction name="NONE" folder="none">
				<step duration="50" file="1.png" />
				<step duration="60" file="2.png" />
				<step duration="80" file="3.png" />
				<step duration="80" file="4.png" />
				<step duration="100" file="5.png" />
				<step duration="80" file="4.png" />
				<step duration="80" file="3.png" />
				<step duration="60" file="2.png" />
				<step duration="50" file="1.png" />
			</direction>
			<direction name="RIGHT" folder="right">
				<step duration="50" file="1.png" />
				<step duration="60" file="2.png" />
				<step duration="80" file="3.png" />
				<step duration="80" file="4.png" />
				<step duration="100" file="5.png" />
				<step duration="80" file="4.png" />
				<step duration="80" file="3.png" />
				<step duration="60" file="2.png" />
				<step duration="50" file="1.png" />
			</direction>
			<direction name="UP" folder="up">
				<step duration="50" file="1.png" />
				<step duration="60" file="2.png" />
				<step duration="80" file="3.png" />
				<step duration="80" file="4.png" />
				<step duration="100" file="5.png" />
				<step duration="80" file="4.png" />
				<step duration="80" file="3.png" />
				<step duration="60" file="2.png" />
				<step duration="50" file="1.png" />
			</direction>
		</gesture>
	</gestures>		
</animes>
