<?xml version="1.0" encoding="utf-8"?>
<animes xmlns:xsi="http://www.w3.org/2001/XMLSchema-instance" 
		xsi:noNamespaceSchemaLocation="../../../../../../../../schemas/animes.xsd" 
		scale="4" >
<!-- 
	Total Boum Boum
	Copyright 2008-2012 Vincent Labatut 
	
	This file is part of Total Boum Boum.
	
	Total Boum Boum is free software: you can redistribute it and/or modify
	it under the terms of the GNU General Public License as published by
	the Free Software Foundation, either version 2 of the License, or
	(at your option) any later version.
	
	Total Boum Boum is distributed in the hope that it will be useful,
	but WITHOUT ANY WARRANTY; without even the implied warranty of
	MERCHANTABILITY or FITNESS FOR A PARTICULAR PURPOSE.  See the
	GNU General Public License for more details.
	
	You should have received a copy of the GNU General Public License
	along with Total Boum Boum.  If not, see <http://www.gnu.org/licenses/>.
 -->
	
	<gestures>
		<gesture name="APPEARING" folder="appearing" proportional="true">
			<direction name="NONE">
				<step duration="75" file="1.png" />
				<step duration="75" file="2.png" />
				<step duration="75" file="3.png" />
				<step duration="100" file="4.png" shadow="shadow2" shadowYShift="1.4" />
				<step duration="100" file="5.png" shadow="shadow3" shadowYShift="1.9" />
			</direction>
		</gesture>

		<gesture name="BURNING" folder="burning">
			<direction name="NONE">
				<step duration="150" file="1.png" />
				<step duration="100" file="2.png" />
				<step duration="200" file="3.png" />
				<step duration="75" name="burning4" />
				<step duration="75" name="burning5" />
				<step duration="75" name="burning6" />
				<step duration="75" name="burning7" />
				<step duration="75" name="burning8" />
			</direction>
		</gesture>

		<gesture name="STANDING" folder="standing" shadow="shadow4" shadowYShift="3.4">
			<direction name="NONE">
				<step file="0.png" />
			</direction>
		</gesture>
	</gestures>
</animes>
