<?xml version="1.0" encoding="utf-8"?>
<animes xmlns:xsi="http://www.w3.org/2001/XMLSchema-instance" 
		xsi:noNamespaceSchemaLocation="../../../../../schemas/animes.xsd" 
		scale="8" >

	<images >
		<image name="smoke1" file="1.png" folder="smoke"/>
		<image name="smoke2" file="2.png" folder="smoke"/>
		<image name="smoke3" file="3.png" folder="smoke"/>
		<image name="smoke4" file="4.png" folder="smoke"/>		
	</images>

	<gestures>

		<gesture name="BURNING" repeat="false" folder="burning">
			<direction name="NONE">
				<step duration="400" file="1.png" />
				<step duration="200" file="2.png" />
				<step duration="150" file="3.png" />
				<step duration="125" file="4.png" />
			</direction>
		</gesture>
		
	</gestures>		
</animes>
