<?xml version="1.0" encoding="utf-8"?>
<animes xmlns:xsi="http://www.w3.org/2001/XMLSchema-instance" 
		xsi:noNamespaceSchemaLocation="../../../../../../../../schemas/animes.xsd" 
		scale="1" >
<!-- 
	Total Boum Boum
	Copyright 2008-2013 Vincent Labatut 
	
	This file is part of Total Boum Boum.
	
	Total Boum Boum is free software: you can redistribute it and/or modify
	it under the terms of the GNU General Public License as published by
	the Free Software Foundation, either version 2 of the License, or
	(at your option) any later version.
	
	Total Boum Boum is distributed in the hope that it will be useful,
	but WITHOUT ANY WARRANTY; without even the implied warranty of
	MERCHANTABILITY or FITNESS FOR A PARTICULAR PURPOSE.  See the
	GNU General Public License for more details.
	
	You should have received a copy of the GNU General Public License
	along with Total Boum Boum.  If not, see <http://www.gnu.org/licenses/>.
 -->
		
	<gestures>
		<gesture name="BOUNCING" shadow="fallShadow" shadowYShift="-7">
			<direction name="NONE">
				<step name="standing" />
			</direction>
		</gesture>

		<gesture name="LANDING" shadow="standShadow" shadowYShift="3">
			<direction name="NONE">
				<step name="standing" />
			</direction>
		</gesture>
		
		<gesture name="STANDING" repeat="true" >
			<direction name="NONE">
				<step duration="1600" name="appearing4" shadow="shadow" shadowYShift="4"/>
				<step duration="100" name="appearing3"/>
				<step duration="50" name="appearing2"/>
				<step duration="50" name="appearing1"/>
				<step duration="650" />
				<step duration="50" name="appearing1"/>
				<step duration="50" name="appearing2"/>
				<step duration="100" name="appearing3"/>
			</direction>
		</gesture>
	</gestures>
</animes>
